{
  "id": "plank_hold",
  "schemaVersion": "0.2.0",
  "nameKey": "exercise.plank_hold.name",
  "descriptionKey": "exercise.plank_hold.description",
  "type": "isometric",
  "movementPatternId": "anti_extension_core",
  "exerciseFamilyId": "plank",
  "difficulty": 2,
  "equipment": [
    "floor",
    "mat"
  ],
  "homeFriendly": true,
  "sideModel": "bilateral",
  "defaultPrescription": {
    "sets": 3,
    "holdSeconds": 30,
    "restSeconds": 60,
    "intensityTarget": 7
  },
  "muscles": {
    "primary": [
      {
        "id": "core",
        "load": 0.8
      },
      {
        "id": "transverse_abdominis",
        "load": 0.7
      }
    ],
    "secondary": [
      {
        "id": "glutes",
        "load": 0.4
      },
      {
        "id": "deltoids",
        "load": 0.4
      }
    ],
    "stabilizers": [
      {
        "id": "shoulder_stabilizers",
        "load": 0.5
      },
      {
        "id": "serratus_anterior",
        "load": 0.4
      }
    ]
  },
  "jointStress": {
    "lumbar_spine": {
      "midline": 0.3
    },
    "shoulder": {
      "bilateral": 0.3
    },
    "wrist": {
      "bilateral": 0.1
    }
  },
  "fatigueCost": {
    "global": 5,
    "local": {
      "core": 7,
      "deltoids": 3
    },
    "joint": {
      "lumbar_spine": {
        "midline": 3
      },
      "shoulder": {
        "bilateral": 3
      }
    }
  },
  "progression": [
    {
      "id": "knees_20s",
      "labelKey": "progression.plank_hold.knees_20s",
      "holdSeconds": 20,
      "difficulty": 1,
      "variationKey": "variation.knees"
    },
    {
      "id": "forearm_30s",
      "labelKey": "progression.plank_hold.forearm_30s",
      "holdSeconds": 30,
      "difficulty": 2,
      "variationKey": "variation.forearm"
    },
    {
      "id": "forearm_45s",
      "labelKey": "progression.plank_hold.forearm_45s",
      "holdSeconds": 45,
      "difficulty": 3,
      "variationKey": "variation.forearm"
    },
    {
      "id": "forearm_60s",
      "labelKey": "progression.plank_hold.forearm_60s",
      "holdSeconds": 60,
      "difficulty": 4,
      "variationKey": "variation.forearm"
    }
  ],
  "regressions": [
    "kneeling_plank_hold"
  ],
  "alternatives": [
    "hollow_body_hold",
    "bear_crawl_hold"
  ],
  "contraindications": [
    "acute_low_back_pain",
    "acute_shoulder_pain",
    "requires_floor_access"
  ],
  "cues": {
    "setup": [
      "exercise.plank_hold.cue.setup.1",
      "exercise.plank_hold.cue.setup.2"
    ],
    "during": [
      "exercise.plank_hold.cue.during.1",
      "exercise.plank_hold.cue.during.2"
    ],
    "stopIf": [
      "exercise.plank_hold.cue.stop_if.1",
      "exercise.plank_hold.cue.stop_if.2"
    ]
  },
  "assets": {
    "illustration": "assets/illustrations/plank_hold.svg",
    "muscleMapFront": "assets/muscles/plank_hold_front.svg",
    "muscleMapBack": "assets/muscles/plank_hold_back.svg",
    "jointMapFront": "assets/joints/plank_hold_front.svg",
    "jointMapBack": "assets/joints/plank_hold_back.svg"
  }
}
