{
  "id": "single_leg_balance_hold",
  "schemaVersion": "0.2.0",
  "nameKey": "exercise.single_leg_balance_hold.name",
  "descriptionKey": "exercise.single_leg_balance_hold.description",
  "type": "balance",
  "movementPatternId": "single_leg_balance",
  "exerciseFamilyId": "single_leg_balance",
  "difficulty": 1,
  "equipment": [
    "none"
  ],
  "homeFriendly": true,
  "sideModel": "left_right",
  "defaultPrescription": {
    "sets": 2,
    "holdSeconds": 20,
    "restSeconds": 20,
    "intensityTarget": 5
  },
  "muscles": {
    "primary": [
      {
        "id": "glute_medius",
        "load": 0.4
      },
      {
        "id": "calves",
        "load": 0.4
      }
    ],
    "secondary": [
      {
        "id": "tibialis_anterior",
        "load": 0.3
      },
      {
        "id": "core",
        "load": 0.3
      }
    ],
    "stabilizers": [
      {
        "id": "core",
        "load": 0.2
      }
    ]
  },
  "jointStress": {
    "ankle": {
      "workingSide": 0.3
    },
    "hip": {
      "workingSide": 0.2
    },
    "knee": {
      "workingSide": 0.1
    }
  },
  "fatigueCost": {
    "global": 2,
    "local": {
      "calves": 3,
      "glute_medius": 3,
      "core": 2
    },
    "joint": {
      "ankle": {
        "workingSide": 3
      },
      "hip": {
        "workingSide": 2
      }
    }
  },
  "progression": [
    {
      "id": "supported_15s",
      "labelKey": "progression.single_leg_balance_hold.supported_15s",
      "holdSeconds": 15,
      "difficulty": 1,
      "variationKey": "variation.supported"
    },
    {
      "id": "unsupported_20s",
      "labelKey": "progression.single_leg_balance_hold.unsupported_20s",
      "holdSeconds": 20,
      "difficulty": 2,
      "variationKey": "variation.unsupported"
    },
    {
      "id": "unsupported_45s",
      "labelKey": "progression.single_leg_balance_hold.unsupported_45s",
      "holdSeconds": 45,
      "difficulty": 3,
      "variationKey": "variation.unsupported"
    },
    {
      "id": "head_turns_30s",
      "labelKey": "progression.single_leg_balance_hold.head_turns_30s",
      "holdSeconds": 30,
      "difficulty": 4,
      "variationKey": "variation.head_turns"
    }
  ],
  "regressions": [
    "supported_single_leg_balance"
  ],
  "alternatives": [
    "calf_raise_hold"
  ],
  "contraindications": [
    "dizziness"
  ],
  "cues": {
    "setup": [
      "exercise.single_leg_balance_hold.cue.setup.1",
      "exercise.single_leg_balance_hold.cue.setup.2"
    ],
    "during": [
      "exercise.single_leg_balance_hold.cue.during.1",
      "exercise.single_leg_balance_hold.cue.during.2"
    ],
    "stopIf": [
      "exercise.single_leg_balance_hold.cue.stop_if.1",
      "exercise.single_leg_balance_hold.cue.stop_if.2"
    ]
  },
  "assets": {
    "illustration": "assets/illustrations/single_leg_balance_hold.svg",
    "muscleMapFront": "assets/muscles/single_leg_balance_hold_front.svg",
    "muscleMapBack": "assets/muscles/single_leg_balance_hold_back.svg",
    "jointMapFront": "assets/joints/single_leg_balance_hold_front.svg",
    "jointMapBack": "assets/joints/single_leg_balance_hold_back.svg"
  }
}
